{
  "$schema": "https://json-schema.org/draft/2020-12/schema",
  "title": "Arabic Charity Case Study",
  "type": "object",
  "additionalProperties": false,
  "required": [
    "document_id",
    "source_files",
    "page_count",
    "case_office",
    "social_unit",
    "research_date",
    "researcher_name",
    "research_purpose",
    "head_of_household_name",
    "head_of_household_age",
    "national_id",
    "insurance_id",
    "phone",
    "address_center",
    "address_governorate",
    "current_job",
    "family_members",
    "housing_type",
    "housing_area",
    "rooms_count",
    "water_available",
    "water_source",
    "furniture_status",
    "rent_amount",
    "housing_independence",
    "assets",
    "social_status_summary",
    "health_status_summary",
    "economic_status_summary",
    "family_needs",
    "previous_aid",
    "attachments",
    "uncertain_fields",
    "review_required",
    "review_notes"
  ],
  "properties": {
    "document_id": {
      "type": "string",
      "minLength": 1
    },
    "source_files": {
      "type": "array",
      "items": {
        "type": "string",
        "minLength": 1
      }
    },
    "page_count": {
      "type": "integer",
      "minimum": 1
    },
    "case_office": {
      "type": [
        "string",
        "null"
      ]
    },
    "social_unit": {
      "type": [
        "string",
        "null"
      ]
    },
    "research_date": {
      "type": [
        "string",
        "null"
      ]
    },
    "researcher_name": {
      "type": [
        "string",
        "null"
      ]
    },
    "research_purpose": {
      "type": [
        "string",
        "null"
      ]
    },
    "head_of_household_name": {
      "type": [
        "string",
        "null"
      ]
    },
    "head_of_household_age": {
      "type": [
        "string",
        "null"
      ]
    },
    "national_id": {
      "type": [
        "string",
        "null"
      ]
    },
    "insurance_id": {
      "type": [
        "string",
        "null"
      ]
    },
    "phone": {
      "type": [
        "string",
        "null"
      ]
    },
    "address_center": {
      "type": [
        "string",
        "null"
      ]
    },
    "address_governorate": {
      "type": [
        "string",
        "null"
      ]
    },
    "current_job": {
      "type": [
        "string",
        "null"
      ]
    },
    "family_members": {
      "type": "array",
      "items": {
        "type": "object",
        "additionalProperties": false,
        "required": [
          "name",
          "relation",
          "age",
          "national_id",
          "social_status",
          "education_status",
          "employment_status",
          "health_status"
        ],
        "properties": {
          "name": {
            "type": [
              "string",
              "null"
            ]
          },
          "relation": {
            "type": [
              "string",
              "null"
            ]
          },
          "age": {
            "type": [
              "string",
              "null"
            ]
          },
          "national_id": {
            "type": [
              "string",
              "null"
            ]
          },
          "social_status": {
            "type": [
              "string",
              "null"
            ]
          },
          "education_status": {
            "type": [
              "string",
              "null"
            ]
          },
          "employment_status": {
            "type": [
              "string",
              "null"
            ]
          },
          "health_status": {
            "type": [
              "string",
              "null"
            ]
          }
        }
      }
    },
    "housing_type": {
      "type": [
        "string",
        "null"
      ]
    },
    "housing_area": {
      "type": [
        "string",
        "null"
      ]
    },
    "rooms_count": {
      "type": [
        "string",
        "null"
      ]
    },
    "water_available": {
      "type": [
        "string",
        "null"
      ]
    },
    "water_source": {
      "type": [
        "string",
        "null"
      ]
    },
    "furniture_status": {
      "type": [
        "string",
        "null"
      ]
    },
    "rent_amount": {
      "type": [
        "string",
        "null"
      ]
    },
    "housing_independence": {
      "type": [
        "string",
        "null"
      ]
    },
    "assets": {
      "type": "array",
      "items": {
        "type": "string"
      }
    },
    "social_status_summary": {
      "type": [
        "string",
        "null"
      ]
    },
    "health_status_summary": {
      "type": [
        "string",
        "null"
      ]
    },
    "economic_status_summary": {
      "type": [
        "string",
        "null"
      ]
    },
    "family_needs": {
      "type": [
        "string",
        "null"
      ]
    },
    "previous_aid": {
      "type": [
        "string",
        "null"
      ]
    },
    "attachments": {
      "type": "array",
      "items": {
        "type": "object",
        "additionalProperties": false,
        "required": [
          "attachment_type",
          "subject_name",
          "national_id",
          "notes"
        ],
        "properties": {
          "attachment_type": {
            "type": [
              "string",
              "null"
            ]
          },
          "subject_name": {
            "type": [
              "string",
              "null"
            ]
          },
          "national_id": {
            "type": [
              "string",
              "null"
            ]
          },
          "notes": {
            "type": [
              "string",
              "null"
            ]
          }
        }
      }
    },
    "uncertain_fields": {
      "type": "array",
      "items": {
        "type": "string"
      }
    },
    "review_required": {
      "type": "boolean"
    },
    "review_notes": {
      "type": "array",
      "items": {
        "type": "string"
      }
    }
  }
}
