{
  "document_id": "case_0001",
  "source_files": [
    "document_parsing/data/raw_images/case_0001_page_1.jpg"
  ],
  "page_count": 1,
  "case_office": null,
  "social_unit": null,
  "research_date": null,
  "researcher_name": null,
  "research_purpose": null,
  "head_of_household_name": null,
  "head_of_household_age": null,
  "national_id": null,
  "insurance_id": null,
  "phone": null,
  "address_center": null,
  "address_governorate": null,
  "current_job": null,
  "family_members": [],
  "housing_type": null,
  "housing_area": null,
  "rooms_count": null,
  "water_available": null,
  "water_source": null,
  "furniture_status": null,
  "rent_amount": null,
  "housing_independence": null,
  "assets": [],
  "social_status_summary": null,
  "health_status_summary": null,
  "economic_status_summary": null,
  "family_needs": null,
  "previous_aid": null,
  "attachments": [],
  "uncertain_fields": [],
  "review_required": false,
  "review_notes": []
}
